[
  {
    "source": "mock-csv",
    "variable": "rainfall",
    "value": 12.5,
    "unit": "mm",
    "latitude": 13.0827,
    "longitude": 80.2707,
    "observed_at": "2024-09-01T06:00:00Z",
    "received_at": "2024-09-01T06:05:00Z",
    "quality_score": 1.0
  },
  {
    "source": "mock-csv",
    "variable": "rainfall",
    "value": 8.2,
    "unit": "mm",
    "latitude": 13.0851,
    "longitude": 80.2784,
    "observed_at": "2024-09-01T07:00:00Z",
    "received_at": "2024-09-01T07:04:00Z",
    "quality_score": 1.0
  },
  {
    "source": "mock-csv",
    "variable": "rainfall",
    "value": 21.7,
    "unit": "mm",
    "latitude": 13.0902,
    "longitude": 80.2651,
    "observed_at": "2024-09-01T08:00:00Z",
    "received_at": "2024-09-01T08:03:00Z",
    "quality_score": 1.0
  },
  {
    "source": "mock-csv",
    "variable": "rainfall",
    "value": 4.1,
    "unit": "mm",
    "latitude": 13.0764,
    "longitude": 80.2819,
    "observed_at": "2024-09-01T09:00:00Z",
    "received_at": "2024-09-01T09:06:00Z",
    "quality_score": 1.0
  },
  {
    "source": "mock-csv",
    "variable": "rainfall",
    "value": 15.9,
    "unit": "mm",
    "latitude": 13.0698,
    "longitude": 80.2603,
    "observed_at": "2024-09-01T10:00:00Z",
    "received_at": "2024-09-01T10:02:00Z",
    "quality_score": 1.0
  }
]
